title,url,summary,num_actions,topic,actions,actions_img,things_needed
How to Tidy New Zealand Flax Plants,www.wikihow.com/Tidy-New-Zealand-Flax-Plants,", it is a good time to tidy any New Zealand flax plants that are growing in your garden. It is easy to do and you will be rewarded with tidier, more vigorously flowering plants next spring.",4,Home and Garden,"{""1"": ""Cut back any flower spikes."", ""2"": ""Remove any dead, browned, or damaged foliage as close to the base of the plant as possible."", ""3"": ""Remove all the cut pieces and compost or put out with garden waste."", ""4"": ""Feed the plant with a nitrogen-rich fertilizer.""}","{""1"": ""https://www.wikihow.com/images/thumb/8/8d/Tidy-New-Zealand-Flax-Plants-Step-1.jpg/aid428765-v4-728px-Tidy-New-Zealand-Flax-Plants-Step-1.jpg"", ""2"": ""https://www.wikihow.com/images/thumb/9/92/Tidy-New-Zealand-Flax-Plants-Step-2.jpg/aid428765-v4-728px-Tidy-New-Zealand-Flax-Plants-Step-2.jpg"", ""3"": ""https://www.wikihow.com/images/thumb/5/52/Tidy-New-Zealand-Flax-Plants-Step-3.jpg/aid428765-v4-728px-Tidy-New-Zealand-Flax-Plants-Step-3.jpg"", ""4"": ""https://www.wikihow.com/images/thumb/4/41/Tidy-New-Zealand-Flax-Plants-Step-4.jpg/aid428765-v4-728px-Tidy-New-Zealand-Flax-Plants-Step-4.jpg""}","Sharp garden ,knife,######,Garden refuse bag or wheelbarrow to carry cuttings away"
How to Make a Pipe Cleaner Bird,www.wikihow.com/Make-a-Pipe-Cleaner-Bird,Pipe cleaner arts and crafts can be a fun way to entertain kids or the kid in all of us. Here are simple instructions to build a bird with five standard pipe cleaners.,4,Hobbies and Crafts,"{""1"": ""Bend one pipe cleaner in half to form the legs."", ""2"": ""Shape another pipe cleaner to form the body."", ""3"": ""Move 1.5 inches (3.8 cm) from the tip of where the beak should be."", ""4"": ""Use 2 pipe cleaners to enlarge the torso.""}","{""1"": ""https://www.wikihow.com/images/thumb/9/97/Make-a-Pipe-Cleaner-Bird-Step-1.jpg/aid198256-v4-728px-Make-a-Pipe-Cleaner-Bird-Step-1.jpg"", ""2"": ""https://www.wikihow.com/images/thumb/9/9b/Make-a-Pipe-Cleaner-Bird-Step-2.jpg/aid198256-v4-728px-Make-a-Pipe-Cleaner-Bird-Step-2.jpg"", ""3"": ""https://www.wikihow.com/images/thumb/c/c9/Make-a-Pipe-Cleaner-Bird-Step-3.jpg/aid198256-v4-728px-Make-a-Pipe-Cleaner-Bird-Step-3.jpg"", ""4"": ""https://www.wikihow.com/images/thumb/7/71/Make-a-Pipe-Cleaner-Bird-Step-4.jpg/aid198256-v4-728px-Make-a-Pipe-Cleaner-Bird-Step-4.jpg""}","5 pipe cleaners (also known as chenille sticks),Ruler to help measure and bend the pipe cleaners"
How to Make Basil Dressing,www.wikihow.com/Make-Basil-Dressing,Basil dressing is simply delicious - definitely one for the basil fans. It is easy to make and can be whipped up just before serving the salad.,4,Food and Entertaining,"{""1"": ""Put the first three ingredients in a blender and mix until smoothly blended."", ""2"": ""Add the extra virgin olive oil."", ""3"": ""Drizzle over hot, perhaps a grilled chicken or over anything that takes your fancy."", ""4"": ""Finished.""}","{""1"": ""https://www.wikihow.com/images/thumb/e/e4/Make-Basil-Dressing-Step-1.jpg/aid521110-v4-728px-Make-Basil-Dressing-Step-1.jpg"", ""2"": ""https://www.wikihow.com/images/thumb/7/7d/Make-Basil-Dressing-Step-2.jpg/aid521110-v4-728px-Make-Basil-Dressing-Step-2.jpg"", ""3"": ""https://www.wikihow.com/images/thumb/f/f3/Make-Basil-Dressing-Step-3.jpg/aid521110-v4-728px-Make-Basil-Dressing-Step-3.jpg"", ""4"": ""https://www.wikihow.com/images/thumb/d/d0/Make-Basil-Dressing-Intro.jpg/aid521110-v4-728px-Make-Basil-Dressing-Intro.jpg""}",Blender
How to Protect Chrysanthemums from Wind,www.wikihow.com/Protect-Chrysanthemums-from-Wind,"######Chrysanthemums can succumb under windy conditions, with their heavy flower heads and tender stems. Here is a way to give them some support.",4,Home and Garden,"{""1"": ""Cut a length of garden netting that will go along the length of your chrysanthemum plants."", ""2"": ""Tie string onto each of the four corners of the garden netting."", ""3"": ""Tie each end of the string to a fence or supportive structure next to the chrysanthemums."", ""4"": ""Let the chrysanthemums fall back onto the netting.""}","{""1"": ""https://www.wikihow.com/images/thumb/b/b9/Protect-Chrysanthemums-from-Wind-Step-1.jpg/aid521048-v4-728px-Protect-Chrysanthemums-from-Wind-Step-1.jpg"", ""2"": ""https://www.wikihow.com/images/thumb/d/d1/Protect-Chrysanthemums-from-Wind-Step-2.jpg/aid521048-v4-728px-Protect-Chrysanthemums-from-Wind-Step-2.jpg"", ""3"": ""https://www.wikihow.com/images/thumb/e/e7/Protect-Chrysanthemums-from-Wind-Step-3.jpg/aid521048-v4-728px-Protect-Chrysanthemums-from-Wind-Step-3.jpg"", ""4"": ""https://www.wikihow.com/images/thumb/a/a8/Protect-Chrysanthemums-from-Wind-Step-4.jpg/aid521048-v4-728px-Protect-Chrysanthemums-from-Wind-Step-4.jpg""}","Garden netting,Scissors,String,Stakes (optional)"
How to Play Call of Duty 5 on Veteran Difficulty,www.wikihow.com/Play-Call-of-Duty-5-on-Veteran-Difficulty,Are you getting frustrated with the insane grenades of Call of Duty 5? What about the stupid teammates that don&#x27;t know how to shoot? Follow this guide and you&#x27;ll get through the campaign quicker than the speed of light!,4,Hobbies and Crafts,"{""1"": ""Start off with the first level."", ""2"": ""Always use cover."", ""3"": ""Never, I repeat, NEVER go into an open battlefield with a half empty clip."", ""4"": ""Stay by teammates.""}","{""1"": ""https://www.wikihow.com/images/thumb/c/c8/Play-Call-of-Duty-5-on-Veteran-Difficulty-Step-1.jpg/aid619829-v4-728px-Play-Call-of-Duty-5-on-Veteran-Difficulty-Step-1.jpg"", ""2"": ""https://www.wikihow.com/images/thumb/b/b6/Play-Call-of-Duty-5-on-Veteran-Difficulty-Step-2.jpg/aid619829-v4-728px-Play-Call-of-Duty-5-on-Veteran-Difficulty-Step-2.jpg"", ""3"": ""https://www.wikihow.com/images/thumb/8/85/Play-Call-of-Duty-5-on-Veteran-Difficulty-Step-3.jpg/aid619829-v4-728px-Play-Call-of-Duty-5-on-Veteran-Difficulty-Step-3.jpg"", ""4"": ""https://www.wikihow.com/images/thumb/2/2f/Play-Call-of-Duty-5-on-Veteran-Difficulty-Step-4.jpg/aid619829-v4-728px-Play-Call-of-Duty-5-on-Veteran-Difficulty-Step-4.jpg""}","Call of Duty: World at War,A T.V./computer,A controller/keyboard"
How to Make Imli Ki Chutney (Tamarind Chutney),www.wikihow.com/Make-Imli-Ki-Chutney-(Tamarind-Chutney), and is also an integral part of many chat items (A variety of savoury snacks),4,Food and Entertaining,"{""1"": ""In a pan add the tamarind pulp, the sugar/jaggery, and all other ingredients."", ""2"": ""Boil till the paste thickens to a ketchup like consistency."", ""3"": ""Pour into another bowl and allow it cool."", ""4"": ""Finished.""}","{""1"": ""https://www.wikihow.com/images/thumb/4/47/Add-ingredients-in-pan-Step-1.jpg/aid352099-v4-728px-Add-ingredients-in-pan-Step-1.jpg"", ""2"": ""https://www.wikihow.com/images/thumb/b/b3/Cook-till-Thick-Step-2.jpg/aid352099-v4-728px-Cook-till-Thick-Step-2.jpg"", ""3"": ""https://www.wikihow.com/images/thumb/2/20/Tranfer-in-Another-bowl-and-cool-Step-3.jpg/aid352099-v4-728px-Tranfer-in-Another-bowl-and-cool-Step-3.jpg"", ""4"": ""https://www.wikihow.com/images/thumb/6/65/Make-Imli-ki-Chutni-Intro.jpg/aid352099-v4-728px-Make-Imli-ki-Chutni-Intro.jpg""}","2 cups - Tamarind Pulp (Soak tamarind in water and squeeze out the pulp),1/2 cup water,2 Tbsp - Gud (Jaggery) or sugar,1 tsp - Red Chilli powder,1 tsp - Cumin powder,1 tsp - Amchur powder (dry mango powder) (optional),4-5 dates (optional),5-6 raisins (optional),Salt to taste,Black salt (optional)"
How to Clean Bath Drip Stains,www.wikihow.com/Clean-Bath-Drip-Stains,"A constantly dripping tap (faucet) can leave marks on a bath. This can be an issue when purchasing an old, used antique bath as well as your regular bath. So, after you&#x27;ve attended to the cause of the drips so that you can reduce your water usage, here is how to clean the stains.",4,Home and Garden,"{""1"": ""Warm up a bowl of vinegar."", ""2"": ""Dip a sponge into the warmed vinegar."", ""3"": ""Rub at the stains with the sponge."", ""4"": ""Keep rubbing until the stains come off.""}","{""1"": ""https://www.wikihow.com/images/thumb/4/43/Clean-Bath-Drip-Stains-Step-1.jpg/aid516854-v4-728px-Clean-Bath-Drip-Stains-Step-1.jpg"", ""2"": ""https://www.wikihow.com/images/thumb/4/4f/Clean-Bath-Drip-Stains-Step-2.jpg/aid516854-v4-728px-Clean-Bath-Drip-Stains-Step-2.jpg"", ""3"": ""https://www.wikihow.com/images/thumb/f/f5/Clean-Bath-Drip-Stains-Step-3.jpg/aid516854-v4-728px-Clean-Bath-Drip-Stains-Step-3.jpg"", ""4"": ""https://www.wikihow.com/images/thumb/b/b4/Clean-Bath-Drip-Stains-Step-4.jpg/aid516854-v4-728px-Clean-Bath-Drip-Stains-Step-4.jpg""}","Saucepan,Vinegar,Sponge,Rubber gloves (optional)"
How to Defeat Huff N&#x27; Puff in Paper Mario,www.wikihow.com/Defeat-Huff-N'-Puff-in-Paper-Mario,"2 Star Spirits remain, but the boss who you must defeat is very difficult. But he isn&#x27;t when you read this guide.",4,Hobbies and Crafts,"{""1"": ""Use the &quot;Happy Heart&quot; badge to up your HP to 50 - 55."", ""2"": ""When you enter the battle use your Star Power."", ""3"": ""&quot;Chill Out&quot; 1 - 3 times."", ""4"": ""Use Lakilester&#x27;s &quot;Spiny Surge.""}","{""1"": ""https://www.wikihow.com/images/thumb/5/5c/Defeat-Huff-N%27-Puff-in-Paper-Mario-Step-1.jpg/aid294809-v4-728px-Defeat-Huff-N%27-Puff-in-Paper-Mario-Step-1.jpg"", ""2"": ""https://www.wikihow.com/images/thumb/0/0d/Defeat-Huff-N%27-Puff-in-Paper-Mario-Step-2.jpg/aid294809-v4-728px-Defeat-Huff-N%27-Puff-in-Paper-Mario-Step-2.jpg"", ""3"": ""https://www.wikihow.com/images/thumb/b/b3/Defeat-Huff-N%27-Puff-in-Paper-Mario-Step-3.jpg/aid294809-v4-728px-Defeat-Huff-N%27-Puff-in-Paper-Mario-Step-3.jpg"", ""4"": ""https://www.wikihow.com/images/e/e3/Defeat-Huff-N%27-Puff-in-Paper-Mario-Step-4.jpg""}","Nintendo 64,Paper Mario cartridge,Stone Hats,Patience,An Ultra Ranked Goombario,Plenty of FP"
How to Make a Honey Glazed Salad,www.wikihow.com/Make-a-Honey-Glazed-Salad,"Here&#x27;s a beautiful, delicious and incredibly easy to make healthy salad recipe. Find recipes that create a tasty meal, in the fewest possible steps, with ingredients you&#x27;ll find in any supermarket.  It&#x27;s faster to cook a healthy meal like this than it is to buy fast food.",4,Food and Entertaining,"{""1"": ""Cover with the lid and let the steam soften the carrots just a little."", ""2"": ""Quickly blanch the green beans:"", ""3"": ""Now here&#x27;s the easy part - putting it together."", ""4"": ""Here&#x27;s your easy healthy salad recipe!""}","{""1"": ""https://www.wikihow.com/images/thumb/9/99/Make-a-Honey-Glazed-Salad-Step-1.jpg/aid3193885-v4-728px-Make-a-Honey-Glazed-Salad-Step-1.jpg"", ""2"": ""https://www.wikihow.com/images/thumb/1/1e/Make-a-Honey-Glazed-Salad-Step-2.jpg/aid3193885-v4-728px-Make-a-Honey-Glazed-Salad-Step-2.jpg"", ""3"": ""https://www.wikihow.com/images/thumb/0/06/Make-a-Honey-Glazed-Salad-Step-3.jpg/aid3193885-v4-728px-Make-a-Honey-Glazed-Salad-Step-3.jpg"", ""4"": ""https://www.wikihow.com/images/thumb/5/57/Make-a-Honey-Glazed-Salad-Step-4.jpg/aid3193885-v4-728px-Make-a-Honey-Glazed-Salad-Step-4.jpg""}","######,######,Will serve as a meal for four, or sides for four.,######,######,1 large carrot, peeled and cut into slim strips,1/2 pound (250gm) green beans, also known as french beans,1/2 cup water x 2,a pinch of salt,1 tablespoon herb infused olive oil,1 tablespoon honey,1 can/12 oz/400gm can of cannelloni or white beans, drained"
How to Remove Rubber Cement from Carpet,www.wikihow.com/Remove-Rubber-Cement-from-Carpet,Rubber cement can accidentally get stuck on the carpet when performing repairs or renovations. Here is how to remove it.,4,Home and Garden,"{""1"": ""Sponge the area using a little portion of dry-cleaning solvent."", ""2"": ""Make a mixture of one tablespoon of a mild, gentle detergent with 236 milliliters (8\u00a0\u00a0fl\u00a0oz) of warm water."", ""3"": ""Blot the mixture over the rubber cement stain."", ""4"": ""Use clean water as a rinse.""}","{""1"": ""https://www.wikihow.com/images/thumb/7/7e/Remove-Rubber-Cement-from-Carpet-Step-1.jpg/aid1271293-v4-728px-Remove-Rubber-Cement-from-Carpet-Step-1.jpg"", ""2"": ""https://www.wikihow.com/images/thumb/3/37/Remove-Rubber-Cement-from-Carpet-Step-2.jpg/aid1271293-v4-728px-Remove-Rubber-Cement-from-Carpet-Step-2.jpg"", ""3"": ""https://www.wikihow.com/images/thumb/7/7b/Remove-Rubber-Cement-from-Carpet-Step-3.jpg/aid1271293-v4-728px-Remove-Rubber-Cement-from-Carpet-Step-3.jpg"", ""4"": ""https://www.wikihow.com/images/thumb/b/bf/Remove-Rubber-Cement-from-Carpet-Step-4.jpg/aid1271293-v4-728px-Remove-Rubber-Cement-from-Carpet-Step-4.jpg""}","Dry-cleaning solvent,Gloves,Sponges,Warm water,Mild detergent (free of bleach or alkalies)"
How to Make a Square Sheet of Paper,www.wikihow.com/Make-a-Square-Sheet-of-Paper,"In origami it&#x27;s very important to start off with a perfectly square sheet of paper. Unless you already have one, you&#x27;ll have to make one. The more square your paper, the better your origami will turn out. This article shows how you can make a square-shaped paper out of any shaped sheet.",4,Hobbies and Crafts,"{""1"": ""Take a single sheet of paper."", ""2"": ""Hold the top right corner of the paper and fold it towards the lower left side."", ""3"": ""Cut this section off using paper scissors."", ""4"": ""Unfold.######//&lt;!""}","{""1"": ""https://www.wikihow.com/video/c/c0/Make a Square Sheet of Paper Step 1 Version 2.360p.mp4"", ""2"": ""https://www.wikihow.com/video/c/c3/Make a Square Sheet of Paper Step 2 Version 2.360p.mp4"", ""3"": ""https://www.wikihow.com/video/d/d5/Make a Square Sheet of Paper Step 3 Version 2.360p.mp4"", ""4"": ""https://www.wikihow.com/video/2/2c/Make a Square Sheet of Paper Step 4 Version 2.360p.mp4""}","Paper,Scissors"
How to Make a Fruit Salad Cube,www.wikihow.com/Make-a-Fruit-Salad-Cube,"This is a visually stunning way to present a fruit salad. It’s also one of those dessert styles where it can please the kids or be suitable for a cocktail party, as it&#x27;s very versatile. This is best made close to serving time.",4,Food and Entertaining,"{""1"": ""Choose the fruit combination."", ""2"": ""Cut the fruit into cubes."", ""3"": ""Do this on the actual serving dish."", ""4"": ""Serve.""}","{""1"": ""https://www.wikihow.com/images/thumb/f/f3/Make-a-Fruit-Salad-Cube-Step-1.jpg/aid2583467-v4-728px-Make-a-Fruit-Salad-Cube-Step-1.jpg"", ""2"": ""https://www.wikihow.com/images/thumb/a/a9/Make-a-Fruit-Salad-Cube-Step-2.jpg/aid2583467-v4-728px-Make-a-Fruit-Salad-Cube-Step-2.jpg"", ""3"": ""https://www.wikihow.com/images/thumb/a/ad/Make-a-Fruit-Salad-Cube-Step-3.jpg/aid2583467-v4-728px-Make-a-Fruit-Salad-Cube-Step-3.jpg"", ""4"": ""https://www.wikihow.com/images/thumb/0/0b/Make-a-Fruit-Salad-Cube-Step-4.jpg/aid2583467-v4-728px-Make-a-Fruit-Salad-Cube-Step-4.jpg""}","Sharp kitchen knife and cutting board,Serving plates"
How to Cut an Overgrown Lawn,www.wikihow.com/Cut-an-Overgrown-Lawn,######Went away for a few weeks and returned home to a jungle? Grass and weeds can go crazy when left untended. Here is how to get started.,4,Home and Garden,"{""1"": ""Remove the weeds first."", ""2"": ""Cut the grass back in stages."", ""3"": ""A lawn that is cut back a lot will benefit from a boost of fertiliser to help it get growing again."", ""4"": ""Try to keep it tended as normal during the remainder of the growing season.""}","{""1"": ""https://www.wikihow.com/images/thumb/b/b0/Cut-an-Overgrown-Lawn-Step-1.jpg/aid517672-v4-728px-Cut-an-Overgrown-Lawn-Step-1.jpg"", ""2"": ""https://www.wikihow.com/images/thumb/4/47/Cut-an-Overgrown-Lawn-Step-2.jpg/aid517672-v4-728px-Cut-an-Overgrown-Lawn-Step-2.jpg"", ""3"": ""https://www.wikihow.com/images/thumb/e/ec/Cut-an-Overgrown-Lawn-Step-3.jpg/aid517672-v4-728px-Cut-an-Overgrown-Lawn-Step-3.jpg"", ""4"": ""https://www.wikihow.com/images/thumb/4/47/Cut-an-Overgrown-Lawn-Step-4.jpg/aid517672-v4-728px-Cut-an-Overgrown-Lawn-Step-4.jpg""}","Lawnmower,Whipper Snipper for weeds (optional),Garden gloves for hand-pulling weeds"
How to Get out of Maps on Halo 3,www.wikihow.com/Get-out-of-Maps-on-Halo-3,If you have a crave to explore more areas read this article,4,Hobbies and Crafts,"{""1"": ""Make a Mongoose on Valhalla at the edge of the map (the water side)."", ""2"": ""2.jpg|right|184px]]Get in and accelerate forward."", ""3"": ""Make a Wraith about 2 meters (6.6\u00a0ft) back, then ram the accelerating Mongoose."", ""4"": ""For a split second the Mongoose will go out the map.""}","{""1"": ""https://www.wikihow.com/images/thumb/5/53/Get-out-of-Maps-on-Halo-3-Step-1.jpg/aid1873308-v4-728px-Get-out-of-Maps-on-Halo-3-Step-1.jpg"", ""2"": ""https://www.wikihow.com/images/thumb/b/b0/Get-out-of-Maps-on-Halo-3-Step-2.jpg/aid1873308-v4-728px-Get-out-of-Maps-on-Halo-3-Step-2.jpg"", ""3"": ""https://www.wikihow.com/images/thumb/5/5c/Get-out-of-Maps-on-Halo-3-Step-3.jpg/aid1873308-v4-728px-Get-out-of-Maps-on-Halo-3-Step-3.jpg"", ""4"": ""https://www.wikihow.com/images/thumb/e/e9/Get-out-of-Maps-on-Halo-3-Step-4.jpg/aid1873308-v4-728px-Get-out-of-Maps-on-Halo-3-Step-4.jpg""}","Xbox 360,Halo 3,TV"
How to Make Mint Milkshakes,www.wikihow.com/Make-Mint-Milkshakes," is a popular favorite, but it&#x27;s even better when you can drink it in a milkshake. This decadent drink is very refreshing, enjoyable, and may even freshen your breathe! Learn how to make it in a quick and easy way.",4,Food and Entertaining,"{""1"": ""Put all ingredients into the blender."", ""2"": ""Blend for 30-45 seconds or until all ingredients are blended together."", ""3"": ""Pour the milkshake into a tall glass."", ""4"": ""Serve and enjoy!""}","{""1"": ""https://www.wikihow.com/images/thumb/c/cf/Make-Mint-Milkshakes-Step-1.jpg/aid441196-v4-728px-Make-Mint-Milkshakes-Step-1.jpg"", ""2"": ""https://www.wikihow.com/images/thumb/e/e4/Make-Mint-Milkshakes-Step-2.jpg/aid441196-v4-728px-Make-Mint-Milkshakes-Step-2.jpg"", ""3"": ""https://www.wikihow.com/images/thumb/0/0d/Make-Mint-Milkshakes-Step-3.jpg/aid441196-v4-728px-Make-Mint-Milkshakes-Step-3.jpg"", ""4"": ""https://www.wikihow.com/images/thumb/e/e8/Make-Mint-Milkshakes-Step-4.jpg/aid441196-v4-728px-Make-Mint-Milkshakes-Step-4.jpg""}","Blender,Tall glass"
How to Pick Up Broken Glass Splinters,www.wikihow.com/Pick-Up-Broken-Glass-Splinters,"Whilst it can be easy to spot the large shards of broken glass, picking up the splinters is another story and nobody wants to risk accidentally picking up glass splinters in hands, feet and on the knees of crawling babies and pets. This article provides several successful methods for picking up the tiny splinters and sparing your fingers.",4,Home and Garden,"{""1"": ""Try the cotton wool method."", ""2"": ""Try the soap method."", ""3"": ""Try the wet paper method."", ""4"": ""Discard properly.""}","{""1"": ""https://www.wikihow.com/images/3/36/CottonWool-Step-1.jpg"", ""2"": ""https://www.wikihow.com/images/4/4a/SoapMethod-Step-2.jpg"", ""3"": ""https://www.wikihow.com/images/c/c5/NewspaperMethod-Step-3.jpg"", ""4"": ""https://www.wikihow.com/images/9/9b/Discard-Step-4.jpg""}","Cotton wool (absorbent cotton),Soap,Paper (newspaper or butcher's paper),Strong plastic bag for disposal,Broom for sweeping large pieces,Bucket to hold the bag of shards"
How to Woohoo in Sims 2,www.wikihow.com/Woohoo-in-Sims-2,&quot;Woohoo&quot; in Sims 2 creates a whole new relationship level for your Sims. It can lead to greater love interests or even pregnancy. Here is how to create the action of &quot;woohoo&quot;.,4,Hobbies and Crafts,"{""1"": ""Set up a man and a woman couple in a house with a double bed."", ""2"": ""Make sure that the two Sims have chemistry between them."", ""3"": ""Have both Sims &quot;relax&quot; in the same double bed."", ""4"": ""Click on &quot;make out&quot;, &quot;cuddle&quot;, and other stuff.""}","{""1"": ""https://www.wikihow.com/images/thumb/a/ac/Woohoo-in-Sims-2-Step-1-Version-2.jpg/aid696894-v4-728px-Woohoo-in-Sims-2-Step-1-Version-2.jpg"", ""2"": ""https://www.wikihow.com/images/thumb/3/30/Woohoo-in-Sims-2-Step-2-Version-2.jpg/aid696894-v4-728px-Woohoo-in-Sims-2-Step-2-Version-2.jpg"", ""3"": ""https://www.wikihow.com/images/thumb/8/8f/Woohoo-in-Sims-2-Step-3-Version-2.jpg/aid696894-v4-728px-Woohoo-in-Sims-2-Step-3-Version-2.jpg"", ""4"": ""https://www.wikihow.com/images/thumb/7/7c/Woohoo-in-Sims-2-Step-4-Version-2.jpg/aid696894-v4-728px-Woohoo-in-Sims-2-Step-4-Version-2.jpg""}","Sims 2 base game,Two Sims,Double bed"
How to Make Vegan Tofurky,www.wikihow.com/Make-Vegan-Tofurky,"At events such as Thanksgiving and Christmas, during which meals often highlight large meat dishes, tofurky can be used as an excellent substitute for vegan guests. Using tofu and a variety of spices, this dish adheres to vegan standards while also providing a delicious, spicy flavor profile.",4,Food and Entertaining,"{""1"": ""Preheat the oven to 350\u00a0\u00b0F (177\u00a0\u00b0C) and lightly oil a cooking sheet."", ""2"": ""In a large bowl, whisk together the oil, garlic, pepper, salt, marjoram, thyme, rosemary, dill and water."", ""3"": ""Place the slices of tofu onto a cookie sheet and coat them with marinade."", ""4"": ""Bake the tofu for 1 hour, flipping them once after the first 30 minutes.""}","{""1"": ""https://www.wikihow.com/images/thumb/4/46/Make-Vegan-Tofurky-Step-1.jpg/aid1700553-v4-728px-Make-Vegan-Tofurky-Step-1.jpg"", ""2"": ""https://www.wikihow.com/images/thumb/8/8a/Make-Vegan-Tofurky-Step-2.jpg/aid1700553-v4-728px-Make-Vegan-Tofurky-Step-2.jpg"", ""3"": ""https://www.wikihow.com/images/thumb/9/9b/Make-Vegan-Tofurky-Step-3.jpg/aid1700553-v4-728px-Make-Vegan-Tofurky-Step-3.jpg"", ""4"": ""https://www.wikihow.com/images/thumb/e/e3/Make-Vegan-Tofurky-Step-4.jpg/aid1700553-v4-728px-Make-Vegan-Tofurky-Step-4.jpg""}","Whisk,Frying pan,Cooking sheet,Large bowl,Spoon"
How to Use Milk to Control Powdery Mildew,www.wikihow.com/Use-Milk-to-Control-Powdery-Mildew, Here is how to use it.,4,Home and Garden,"{""1"": ""Mix one part skim (low-fat) milk with 9 parts of water."", ""2"": ""Place in a spray bottle."", ""3"": ""Spray on plants affected by powdery mildew."", ""4"": ""Make fresh each week.""}","{""1"": ""https://www.wikihow.com/images/thumb/2/28/Use-Milk-to-Control-Powdery-Mildew-Step-1.jpg/aid1274697-v4-728px-Use-Milk-to-Control-Powdery-Mildew-Step-1.jpg"", ""2"": ""https://www.wikihow.com/images/thumb/6/61/Use-Milk-to-Control-Powdery-Mildew-Step-2.jpg/aid1274697-v4-728px-Use-Milk-to-Control-Powdery-Mildew-Step-2.jpg"", ""3"": ""https://www.wikihow.com/images/thumb/1/15/Use-Milk-to-Control-Powdery-Mildew-Step-3.jpg/aid1274697-v4-728px-Use-Milk-to-Control-Powdery-Mildew-Step-3.jpg"", ""4"": ""https://www.wikihow.com/images/thumb/b/ba/Use-Milk-to-Control-Powdery-Mildew-Step-4.jpg/aid1274697-v4-728px-Use-Milk-to-Control-Powdery-Mildew-Step-4.jpg""}","Milk,Water,Mixing container and funnel,Spray bottle (clean)"
How to Make a Pipe Cleaner Chair,www.wikihow.com/Make-a-Chair-(Pipe-Cleaner-Crafts), to sit on.,4,Hobbies and Crafts,"{""1"": ""Bend two same-colored pipe cleaners into half square shapes."", ""2"": ""Loop the end of a pipe cleaner above the front leg."", ""3"": ""Using another pipe cleaner, repeat step 2 on the other side of the chair."", ""4"": ""Meet both ends of the back pipe cleaners, twisting them over each other to close the chair back.""}","{""1"": ""https://www.wikihow.com/images/thumb/5/5f/Make-a-Pipe-Cleaner-Chair-Step-1.jpg/aid209933-v4-728px-Make-a-Pipe-Cleaner-Chair-Step-1.jpg"", ""2"": ""https://www.wikihow.com/images/thumb/8/8b/Make-a-Pipe-Cleaner-Chair-Step-2.jpg/aid209933-v4-728px-Make-a-Pipe-Cleaner-Chair-Step-2.jpg"", ""3"": ""https://www.wikihow.com/images/thumb/d/dc/Make-a-Pipe-Cleaner-Chair-Step-3.jpg/aid209933-v4-728px-Make-a-Pipe-Cleaner-Chair-Step-3.jpg"", ""4"": ""https://www.wikihow.com/images/thumb/0/0c/Make-a-Pipe-Cleaner-Chair-Step-4.jpg/aid209933-v4-728px-Make-a-Pipe-Cleaner-Chair-Step-4.jpg""}",Six pipe cleaners (chenille sticks).
How to Make Apricot Basil Dressing,www.wikihow.com/Make-Apricot-Basil-Dressing,######A very tasty dressing with two superb flavours married together. This can be made quickly just before serving a salad. It also goes well drizzled over hot meat or vegetables.,4,Food and Entertaining,"{""1"": ""Combine the apricots, vinegar, and sugar in a blender."", ""2"": ""With the blender running, slowly add the oil until the dressing becomes thick and smooth."", ""3"": ""Stir in the basil."", ""4"": ""Serve.""}","{""1"": ""https://www.wikihow.com/images/thumb/3/30/Make-Apricot-Basil-Dressing-Step-1.jpg/aid521118-v4-728px-Make-Apricot-Basil-Dressing-Step-1.jpg"", ""2"": ""https://www.wikihow.com/images/thumb/3/3c/Make-Apricot-Basil-Dressing-Step-2.jpg/aid521118-v4-728px-Make-Apricot-Basil-Dressing-Step-2.jpg"", ""3"": ""https://www.wikihow.com/images/thumb/b/b2/Make-Apricot-Basil-Dressing-Step-3.jpg/aid521118-v4-728px-Make-Apricot-Basil-Dressing-Step-3.jpg"", ""4"": ""https://www.wikihow.com/images/thumb/c/ce/Make-Apricot-Basil-Dressing-Step-4.jpg/aid521118-v4-728px-Make-Apricot-Basil-Dressing-Step-4.jpg""}",Blender
