title,url,summary,num_actions,topic,actions,actions_img,things_needed
How to Defeat the Yiazmat in Final Fantasy XII,www.wikihow.com/Defeat-the-Yiazmat-in-Final-Fantasy-XII,"Final Fantasy XII is the best Final Fantasy game built by Square Enix. It has the most refined battle system of real time. Although it has a story, there is one goal all players wants to do. The ultimate mark, Yiazmat. This is a battle that can take up hours so make sure you have the time. Quotes are from finalfantasy.wikia.com.",6,Hobbies and Crafts,"{""1"": ""The petitioner is Montblanc, found in Clan Hall in Rabanastre."", ""2"": ""Take the Strahl (Balthier&#x27;s Airship) to the Ridorana Cataract."", ""3"": ""Cast Decoy on the strongest character with high defense while others cast technique Expose until the maximum damage is 9999."", ""4"": ""&quot;His most annoying tactic is that when his HP goes below 50%, all attacks can only do 6999 damage (assuming your &quot;pre-cap&quot; damage [before being reduced to 9999] is low enough that 6999 is 70% of your damage) at most to him, so it becomes about using combo weapons rather than damage dealers."", ""5"": ""Note that you can leave the battlefield and return with Yiazmat having the same health."", ""6"": ""After a long battle, go back to Rabanastre to claim your reward.""}","{""1"": ""https://www.wikihow.com/images/thumb/1/15/Defeat-the-Yiazmat-in-Final-Fantasy-XII-Step-1.jpg/aid433905-v4-728px-Defeat-the-Yiazmat-in-Final-Fantasy-XII-Step-1.jpg"", ""2"": ""https://www.wikihow.com/images/thumb/4/42/Defeat-the-Yiazmat-in-Final-Fantasy-XII-Step-2.jpg/aid433905-v4-728px-Defeat-the-Yiazmat-in-Final-Fantasy-XII-Step-2.jpg"", ""3"": ""https://www.wikihow.com/images/thumb/6/61/Defeat-the-Yiazmat-in-Final-Fantasy-XII-Step-3.jpg/aid433905-v4-728px-Defeat-the-Yiazmat-in-Final-Fantasy-XII-Step-3.jpg"", ""4"": ""https://www.wikihow.com/images/thumb/b/b3/Defeat-the-Yiazmat-in-Final-Fantasy-XII-Step-4.jpg/aid433905-v4-728px-Defeat-the-Yiazmat-in-Final-Fantasy-XII-Step-4.jpg"", ""5"": ""https://www.wikihow.com/images/thumb/5/51/Defeat-the-Yiazmat-in-Final-Fantasy-XII-Step-5.jpg/aid433905-v4-728px-Defeat-the-Yiazmat-in-Final-Fantasy-XII-Step-5.jpg"", ""6"": ""https://www.wikihow.com/images/thumb/8/86/Defeat-the-Yiazmat-in-Final-Fantasy-XII-Step-6.jpg/aid433905-v4-728px-Defeat-the-Yiazmat-in-Final-Fantasy-XII-Step-6.jpg""}","FFXII game,Practice,3 Yagyu Dark blades or Tournesols.,Grand Armors,Grand helms,At least 1 genji gloves and 3 bubble belts.,Technick Expose.,Patience."
How to Make Nutella Shortcake,www.wikihow.com/Make-Nutella-Shortcake,"Strawberry shortcake has always been a great treat. It&#x27;s both fresh and light. But by adding Nutella, you can take this dessert to the next level. Just follow these steps!",6,Food and Entertaining,"{""1"": ""Cut off the tops and slice them into thick chunks."", ""2"": ""Take a plastic bag and fill it with Nutella."", ""3"": ""In a large bowl, combine the heavy cream, sugar, cocoa powder and vanilla extract in a mixer until soft peaks occur."", ""4"": ""Once the whipped cream is made, gently fold the graham cracker dust into it with a spatula."", ""5"": ""Place the shortcake slice onto a dessert plate."", ""6"": ""Layer, if desired.""}","{""1"": ""https://www.wikihow.com/images/thumb/6/63/Make-Nutella-Shortcake-Step-1.jpg/aid2056707-v4-728px-Make-Nutella-Shortcake-Step-1.jpg"", ""2"": ""https://www.wikihow.com/images/thumb/6/64/Make-Nutella-Shortcake-Step-2.jpg/aid2056707-v4-728px-Make-Nutella-Shortcake-Step-2.jpg"", ""3"": ""https://www.wikihow.com/images/thumb/f/f7/Make-Nutella-Shortcake-Step-3.jpg/aid2056707-v4-728px-Make-Nutella-Shortcake-Step-3.jpg"", ""4"": ""https://www.wikihow.com/images/thumb/d/df/Make-Nutella-Shortcake-Step-4.jpg/aid2056707-v4-728px-Make-Nutella-Shortcake-Step-4.jpg"", ""5"": ""https://www.wikihow.com/images/thumb/2/22/Make-Nutella-Shortcake-Step-5.jpg/aid2056707-v4-728px-Make-Nutella-Shortcake-Step-5.jpg"", ""6"": ""https://www.wikihow.com/images/thumb/c/c5/Make-Nutella-Shortcake-Step-6.jpg/aid2056707-v4-728px-Make-Nutella-Shortcake-Step-6.jpg""}","Cutting board and knife,Plastic bag (food quality),Large mixing bowl,Spatula,Dessert plate"
How to Grow Your Children&#x27;s Names With Garden Cress,www.wikihow.com/Grow-Your-Children's-Names-With-Garden-Cress,"Growing cress in pre-designed shapes is a fun way of creating your children&#x27;s names in the garden. They can watch you do a little gardening, do a little themselves to see how it feels, and then get a great surprise as their names &quot;grow&quot;.",6,Home and Garden,"{""1"": ""Draw your children&#x27;s names in the dirt using a trowel or stick."", ""2"": ""Plant cress seeds in the name area only."", ""3"": ""Keep watering as the cress pops up."", ""4"": ""Encourage your children to watch the cress each day."", ""5"": ""Cut some of the cress for the children and put it on a plate."", ""6"": ""Have the children eat their names.""}","{""1"": ""https://www.wikihow.com/images/thumb/0/0f/Grow-Your-Children%27s-Names-With-Garden-Cress-Step-1.jpg/aid713390-v4-728px-Grow-Your-Children%27s-Names-With-Garden-Cress-Step-1.jpg"", ""2"": ""https://www.wikihow.com/images/thumb/1/18/Grow-Your-Children%27s-Names-With-Garden-Cress-Step-2.jpg/aid713390-v4-728px-Grow-Your-Children%27s-Names-With-Garden-Cress-Step-2.jpg"", ""3"": ""https://www.wikihow.com/images/thumb/9/9a/Grow-Your-Children%27s-Names-With-Garden-Cress-Step-3.jpg/aid713390-v4-728px-Grow-Your-Children%27s-Names-With-Garden-Cress-Step-3.jpg"", ""4"": ""https://www.wikihow.com/images/thumb/a/aa/Grow-Your-Children%27s-Names-With-Garden-Cress-Step-4.jpg/aid713390-v4-728px-Grow-Your-Children%27s-Names-With-Garden-Cress-Step-4.jpg"", ""5"": ""https://www.wikihow.com/images/thumb/9/97/Grow-Your-Children%27s-Names-With-Garden-Cress-Step-5.jpg/aid713390-v4-728px-Grow-Your-Children%27s-Names-With-Garden-Cress-Step-5.jpg"", ""6"": ""https://www.wikihow.com/images/thumb/3/36/Grow-Your-Children%27s-Names-With-Garden-Cress-Step-6.jpg/aid713390-v4-728px-Grow-Your-Children%27s-Names-With-Garden-Cress-Step-6.jpg""}","Cress (lapidium sativum) seeds,Garden space,Trowel,Watering can"
How to Make Blowdarts,www.wikihow.com/Make-Blowdarts,"For the urban hunter a quick how to for making effective blowdarts, useful for taking down anything from pesky pets to annoying co-workers. Silent, accurate and versatile, and most of all, it really works!",6,Hobbies and Crafts,"{""1"": ""Gather the items listed in the &quot;Things you Need&quot; section############"", ""2"": ""Cut both ends the shoelace approximately 2.5cm (1 inch) from the end."", ""3"": ""Fray the shoelace to look like a puffball."", ""4"": ""Part the frayed ends of the shoelace and insert the pin in the center, through the aglet (the plastic or metal trimming located at the end of a shoelace), so that it protrudes on the other end of the puffball."", ""5"": ""After cleaning the pin of the dart with an antiseptic, insert into the tube."", ""6"": ""Finished.######//&lt;!""}","{""1"": ""https://www.wikihow.com/images/thumb/c/c6/Make-Blowdarts-Step-1-Version-2.jpg/aid158239-v4-728px-Make-Blowdarts-Step-1-Version-2.jpg"", ""2"": ""https://www.wikihow.com/video/f/f2/Make Blowdarts Step 2.360p.mp4"", ""3"": ""https://www.wikihow.com/video/d/dd/Make Blowdarts Step 3.360p.mp4"", ""4"": ""https://www.wikihow.com/video/c/c4/Make Blowdarts Step 4.360p.mp4"", ""5"": ""https://www.wikihow.com/video/9/97/Make Blowdarts Step 5.360p.mp4"", ""6"": ""https://www.wikihow.com/video/f/f9/Make Blowdarts Step 6.360p.mp4""}","Shoelaces,Pins,Tube (approx 1.5cm or 1/2 in. diameter),Antiseptic"
How to Make Sausage and Penne Pasta,www.wikihow.com/Make-Sausage-and-Penne-Pasta,"Sausage and penne pasta makes for a hearty and tasty combination of ingredients. You can vary the sausage as required, or stick with the recommended one.",6,Food and Entertaining,"{""1"": ""Bring enough water to boil."", ""2"": ""Saut\u00e9 the sausages in olive oil."", ""3"": ""Cook until slightly limp."", ""4"": ""Add the cooked pasta."", ""5"": ""Add the feta cheese last, and some lemon juice and a little shaved rind."", ""6"": ""Remove from the heat.""}","{""1"": ""https://www.wikihow.com/images/thumb/6/6a/Make-Sausage-and-Penne-Pasta-Step-1.jpg/aid5566505-v4-728px-Make-Sausage-and-Penne-Pasta-Step-1.jpg"", ""2"": ""https://www.wikihow.com/images/thumb/f/fb/Make-Sausage-and-Penne-Pasta-Step-2.jpg/aid5566505-v4-728px-Make-Sausage-and-Penne-Pasta-Step-2.jpg"", ""3"": ""https://www.wikihow.com/images/thumb/3/3d/Make-Sausage-and-Penne-Pasta-Step-3.jpg/aid5566505-v4-728px-Make-Sausage-and-Penne-Pasta-Step-3.jpg"", ""4"": ""https://www.wikihow.com/images/thumb/9/94/Make-Sausage-and-Penne-Pasta-Step-4.jpg/aid5566505-v4-728px-Make-Sausage-and-Penne-Pasta-Step-4.jpg"", ""5"": ""https://www.wikihow.com/images/thumb/2/2c/Make-Sausage-and-Penne-Pasta-Step-5.jpg/aid5566505-v4-728px-Make-Sausage-and-Penne-Pasta-Step-5.jpg"", ""6"": ""https://www.wikihow.com/images/thumb/5/58/Make-Sausage-and-Penne-Pasta-Step-6.jpg/aid5566505-v4-728px-Make-Sausage-and-Penne-Pasta-Step-6.jpg""}","Large saucepan,Wooden spoon or pasta spoon for stirring and transferring,Frying pan or skillet with high sides,Spatula or tongs for sausages,Serving plates"
How to Fix Crumbling Chimney Mortar,www.wikihow.com/Fix-Crumbling-Chimney-Mortar,"Brick is a sturdy, long-lasting building material. However, the mortar that holds bricks together, a mixture of cement and sand, can weaken and crumble. Repairing the crumbling mortar before the bricks fall is called tuck-pointing or re-pointing the bricks. To fix crumbling chimney mortar, follow some common steps.",6,Home and Garden,"{""1"": ""Clean the damaged area."", ""2"": ""Remove the damaged mortar from the joint(s) that you are going to repair."", ""3"": ""Apply a thin layer of commercial bonding agent to the exposed surface of the joint(s) that you are repairing."", ""4"": ""Prepare the mortar according to the manufacturer&#x27;s instructions as found on the package."", ""5"": ""Apply the fresh mortar to the joint using a trowel, and force it in using a joint strike."", ""6"": ""Finish the joint by running a gloved finger along the joint to remove the excess mortar.""}","{""1"": ""https://www.wikihow.com/images/thumb/e/e6/Fix-Crumbling-Chimney-Mortar-Step-1.jpg/aid1369273-v4-728px-Fix-Crumbling-Chimney-Mortar-Step-1.jpg"", ""2"": ""https://www.wikihow.com/images/thumb/b/b5/Fix-Crumbling-Chimney-Mortar-Step-2.jpg/aid1369273-v4-728px-Fix-Crumbling-Chimney-Mortar-Step-2.jpg"", ""3"": ""https://www.wikihow.com/images/thumb/3/3b/Fix-Crumbling-Chimney-Mortar-Step-3.jpg/aid1369273-v4-728px-Fix-Crumbling-Chimney-Mortar-Step-3.jpg"", ""4"": ""https://www.wikihow.com/images/thumb/8/8d/Fix-Crumbling-Chimney-Mortar-Step-4.jpg/aid1369273-v4-728px-Fix-Crumbling-Chimney-Mortar-Step-4.jpg"", ""5"": ""https://www.wikihow.com/images/thumb/9/9a/Fix-Crumbling-Chimney-Mortar-Step-5.jpg/aid1369273-v4-728px-Fix-Crumbling-Chimney-Mortar-Step-5.jpg"", ""6"": ""https://www.wikihow.com/images/thumb/b/b5/Fix-Crumbling-Chimney-Mortar-Step-6.jpg/aid1369273-v4-728px-Fix-Crumbling-Chimney-Mortar-Step-6.jpg""}","Stiff-bristled brush,Dish soap or commercial brick cleaner and water,Eye protection,Work gloves,Wire brush,Hammer,Chisel,Commercial bonding agent,Drill with mixing paddle,Mortar mix,Bucket or other container to mix mortar in,Joint strike"
How to Breed on Nintendogs,www.wikihow.com/Breed-on-Nintendogs,"Some people aren&#x27;t aware of it, put it is possible for your Nintendogs to breed! The Nintendogs couple can have up to one pup at a time. The puppy is like the parents but smaller and cuter!",6,Hobbies and Crafts,"{""1"": ""Buy a male and female dog of the same breed on the same day."", ""2"": ""Get the dogs to bond."", ""3"": ""You can even put music on for breeding."", ""4"": ""Feed the dogs only milk and dry food or natural dog food."", ""5"": ""Do this routine for about 4 days or until the female gets fat."", ""6"": ""Wait.""}","{""1"": ""https://www.wikihow.com/images/thumb/2/2c/Breed-on-Nintendogs-Step-1-Version-3.jpg/aid1821932-v4-728px-Breed-on-Nintendogs-Step-1-Version-3.jpg"", ""2"": ""https://www.wikihow.com/images/thumb/8/89/Breed-on-Nintendogs-Step-2-Version-3.jpg/aid1821932-v4-728px-Breed-on-Nintendogs-Step-2-Version-3.jpg"", ""3"": ""https://www.wikihow.com/images/thumb/e/e7/Breed-on-Nintendogs-Step-3-Version-3.jpg/aid1821932-v4-728px-Breed-on-Nintendogs-Step-3-Version-3.jpg"", ""4"": ""https://www.wikihow.com/images/thumb/d/da/Breed-on-Nintendogs-Step-4-Version-3.jpg/aid1821932-v4-728px-Breed-on-Nintendogs-Step-4-Version-3.jpg"", ""5"": ""https://www.wikihow.com/images/thumb/3/38/Breed-on-Nintendogs-Step-5-Version-3.jpg/aid1821932-v4-728px-Breed-on-Nintendogs-Step-5-Version-3.jpg"", ""6"": ""https://www.wikihow.com/images/thumb/d/d3/Breed-on-Nintendogs-Step-6.jpg/aid1821932-v4-728px-Breed-on-Nintendogs-Step-6.jpg""}","A Nintendo DS, DSi, or 3DS,Nintendogs game,Male and female dog,Milk and dry or natural dog food"
How to Make a Blowback Cocktail,www.wikihow.com/Make-a-Blowback-Cocktail,This cocktail will &quot;blow&quot; you away with a knock-out flavor and taste. So very yummy apple and coconut in one drink -- try this blowback cocktail.,6,Food and Entertaining,"{""1"": ""Fill your mixing glass halfway with ice cubes."", ""2"": ""Pour the coconut and apple liqueurs in the mixing glass."", ""3"": ""Use your stirrer and stir everything well."", ""4"": ""Attach a strainer to your mixing glass and strain the contents in your martini glass."", ""5"": ""Cut a wedge on the apple slice and place it on the side of the martini glass."", ""6"": ""Serve and enjoy.######//&lt;!""}","{""1"": ""https://www.wikihow.com/video/7/71/Make a Blowback Cocktail Step 1 Version 2.360p.mp4"", ""2"": ""https://www.wikihow.com/video/6/68/Make a Blowback Cocktail Step 2 Version 2.360p.mp4"", ""3"": ""https://www.wikihow.com/video/0/04/Make a Blowback Cocktail Step 3 Version 2.360p.mp4"", ""4"": ""https://www.wikihow.com/video/0/06/Make a Blowback Cocktail Step 4 Version 2.360p.mp4"", ""5"": ""https://www.wikihow.com/video/6/68/Make a Blowback Cocktail Step 5 Version 2.360p.mp4"", ""6"": ""https://www.wikihow.com/video/0/00/Make a Blowback Cocktail Step 6 Version 2.360p.mp4""}","Martini glass,Strainer,Mixing glass,Bar spoon or stirrer,Shot measure"
How to Fold a Napkin Into the Basic Silverware Pouch,www.wikihow.com/Fold-a-Napkin-Into-the-Basic-Silverware-Pouch,"The basic silverware pouch is a very simple napkin fold suitable for any informal occasion. This folded napkin can hold cutlery or chopsticks, creating a neat and finished look on your set table.",6,Home and Garden,"{""1"": ""Fold the napkin into fourths."", ""2"": ""Take the first layer on top of the napkin, and fold it diagonally."", ""3"": ""Flip the napkin over."", ""4"": ""Fold the right side of the napkin almost halfway to the center."", ""5"": ""Repeat the previous step for the other side."", ""6"": ""Flip the napkin over.""}","{""1"": ""https://www.wikihow.com/video/b/b3/Fold a Napkin Into the Basic Silverware Pouch Step 1 Version 2.360p.mp4"", ""2"": ""https://www.wikihow.com/video/c/cf/Fold a Napkin Into the Basic Silverware Pouch Step 2 Version 2.360p.mp4"", ""3"": ""https://www.wikihow.com/video/c/c9/Fold a Napkin Into the Basic Silverware Pouch Step 3 Version 2.360p.mp4"", ""4"": ""https://www.wikihow.com/video/1/1e/Fold a Napkin Into the Basic Silverware Pouch Step 4 Version 2.360p.mp4"", ""5"": ""https://www.wikihow.com/video/3/30/Fold a Napkin Into the Basic Silverware Pouch Step 5 Version 2.360p.mp4"", ""6"": ""https://www.wikihow.com/video/0/0a/Fold a Napkin Into the Basic Silverware Pouch Step 6 Version 2.360p.mp4""}",Quality napkins
How to Make a Tennis Ball Mortar,www.wikihow.com/Make-a-Tennis-Ball-Mortar,Tennis ball mortars are some of the coolest things ever! Good thing this will show you how to construct your own.,6,Hobbies and Crafts,"{""1"": ""If it is cold in your area, try to heat up the tube for about 2 minutes############"", ""2"": ""Drop 2.5mls of lighter fluid down the barrel, making sure some reaches the very bottom."", ""3"": ""Quickly insert the tennis ball, and use a stick or your hand to hold it firmly in place while you shake the mortar for 30 seconds."", ""4"": ""Prop the mortar into a high firing angle and hold it in place with bricks."", ""5"": ""Put the blast tube over the mortar making sure the inside hole can be seen."", ""6"": ""Put on hearing protection.""}","{""1"": ""https://www.wikihow.com/images/thumb/3/3b/Make-a-Tennis-Ball-Mortar-Step-9.jpg/aid272936-v4-728px-Make-a-Tennis-Ball-Mortar-Step-9.jpg"", ""2"": ""https://www.wikihow.com/images/thumb/0/07/Make-a-Tennis-Ball-Mortar-Step-10.jpg/aid272936-v4-728px-Make-a-Tennis-Ball-Mortar-Step-10.jpg"", ""3"": ""https://www.wikihow.com/images/thumb/9/90/Make-a-Tennis-Ball-Mortar-Step-11.jpg/aid272936-v4-728px-Make-a-Tennis-Ball-Mortar-Step-11.jpg"", ""4"": ""https://www.wikihow.com/images/thumb/0/08/Make-a-Tennis-Ball-Mortar-Step-12.jpg/aid272936-v4-728px-Make-a-Tennis-Ball-Mortar-Step-12.jpg"", ""5"": ""https://www.wikihow.com/images/thumb/e/eb/Make-a-Tennis-Ball-Mortar-Step-13.jpg/aid272936-v4-728px-Make-a-Tennis-Ball-Mortar-Step-13.jpg"", ""6"": ""https://www.wikihow.com/images/thumb/3/37/Make-a-Tennis-Ball-Mortar-Step-14.jpg/aid272936-v4-728px-Make-a-Tennis-Ball-Mortar-Step-14.jpg""}","3 Pringles Chips cans,Sandpaper,1 PVC Tube to cover the Pringles cans (Blast Tube),Lighter Fluid (use no other fuels),5mm Drill,Matches,Tennis Ball,Earmuffs,Bricks,Tin Snips/Large Cutting Drill/Jigsaw"
How to Make a Knickerbocker Glory,www.wikihow.com/Make-a-Knickerbocker-Glory,"Layers of ice cream sitting on top of fruit, nuts, ice cream beautifully presented in a tall glass with fruit sauce, clotted cream or whipped cream and topped with a cherry and wafer.",6,Food and Entertaining,"{""1"": ""Get a tall glass (like the type traditionally used to serve milk shakes)."", ""2"": ""Chop fruit into small slices or pieces."", ""3"": ""Add three scoops of ice cream on top of the fruit."", ""4"": ""Pour a fruit sauce over the ice cream - Melba (peach) or raspberry sauce is traditional."", ""5"": ""Top this with Clotted cream (or thick whipped cream)."", ""6"": ""Serve chilled along with a long ice cream spoon and a large napkin.""}","{""1"": ""https://www.wikihow.com/images/thumb/a/a3/Make-a-Knickerbocker-Glory-Step-1.jpg/aid39261-v4-728px-Make-a-Knickerbocker-Glory-Step-1.jpg"", ""2"": ""https://www.wikihow.com/images/thumb/7/7d/Make-a-Knickerbocker-Glory-Step-2.jpg/aid39261-v4-728px-Make-a-Knickerbocker-Glory-Step-2.jpg"", ""3"": ""https://www.wikihow.com/images/thumb/0/0a/Make-a-Knickerbocker-Glory-Step-3.jpg/aid39261-v4-728px-Make-a-Knickerbocker-Glory-Step-3.jpg"", ""4"": ""https://www.wikihow.com/images/thumb/d/d2/Make-a-Knickerbocker-Glory-Step-4.jpg/aid39261-v4-728px-Make-a-Knickerbocker-Glory-Step-4.jpg"", ""5"": ""https://www.wikihow.com/images/thumb/0/09/Make-a-Knickerbocker-Glory-Step-5.jpg/aid39261-v4-728px-Make-a-Knickerbocker-Glory-Step-5.jpg"", ""6"": ""https://www.wikihow.com/images/thumb/b/b0/Make-a-Knickerbocker-Glory-Step-6.jpg/aid39261-v4-728px-Make-a-Knickerbocker-Glory-Step-6.jpg""}","A variety of chopped fruit, such as strawberries, bananas, melon, grapes, and peaches,Vanilla ice cream,Fruit syrup, traditionally peach or raspberry sauce,Clotted cream,Whipped cream (only if clotted cream is not available),Cherry,Ice cream wafer,Chopped hazlenuts (optional)"
How to Make a Lemon Scented Dusting Cloth,www.wikihow.com/Make-a-Lemon-Scented-Dusting-Cloth,"######Damp cleaning is a great means for removing dust without having it float into the air, triggering possible allergic reactions. Buying commercially produced pre-moistened wipes is one means by which you can find a damp dusting item but it is possible to make a healthy and eco-friendly reusable damp dusting cloth at home. This article describes how.",6,Home and Garden,"{""1"": ""Cut cheesecloth/muslin into squares that are about the same size as dusting wipes that you are used to using."", ""2"": ""Pour the lemon oil into the hot water in a bucket."", ""3"": ""Dip the cheesecloth squares into the bucket and allow to soak for about 10 minutes."", ""4"": ""Remove the squares and wring until no water drips out."", ""5"": ""Fold and place inside a container."", ""6"": ""Use as needed.""}","{""1"": ""https://www.wikihow.com/images/thumb/3/3c/Cut-muslin-into-square-Step-1.jpg/aid384286-v4-728px-Cut-muslin-into-square-Step-1.jpg"", ""2"": ""https://www.wikihow.com/images/thumb/6/6f/Pour-lemon-oil-Step-2.jpg/aid384286-v4-728px-Pour-lemon-oil-Step-2.jpg"", ""3"": ""https://www.wikihow.com/images/thumb/3/32/Dip-muslin-into-the-bucket-Step-3.jpg/aid384286-v4-728px-Dip-muslin-into-the-bucket-Step-3.jpg"", ""4"": ""https://www.wikihow.com/images/thumb/8/87/Wring-ang-hang-Step-4.jpg/aid384286-v4-728px-Wring-ang-hang-Step-4.jpg"", ""5"": ""https://www.wikihow.com/images/thumb/0/0e/Fold-and-place-inside-container-Step-5.jpg/aid384286-v4-728px-Fold-and-place-inside-container-Step-5.jpg"", ""6"": ""https://www.wikihow.com/images/thumb/1/1c/Use-as-needed-Step-6.jpg/aid384286-v4-728px-Use-as-needed-Step-6.jpg""}","Cheesecloth/muslin - enough for about half a dozen squares,1/4 cup lemon essential oil,1 pint hot water,Bucket,Storage container"
How to Pass Hitman Contracts &quot;Asylum Aftermath&quot;,www.wikihow.com/Pass-Hitman-Contracts-%22Asylum-Aftermath%22,"The first mission from Hitman Contracts is fairly easy, but be alert.",6,Hobbies and Crafts,"{""1"": ""Before beginning, take the in-game training."", ""2"": ""&quot;Asylum Aftermath&quot; is the first mission."", ""3"": ""Now, use the elevator to reach the 1st floor."", ""4"": ""Use the in-game map to find your exit points."", ""5"": ""After you&#x27;ve left the asylum, look to the left."", ""6"": ""Congratulations!""}","{""1"": ""https://www.wikihow.com/images/thumb/2/21/Pass-Hitman-Contracts-%22Asylum-Aftermath%22-Step-1.jpg/aid915298-v4-728px-Pass-Hitman-Contracts-%22Asylum-Aftermath%22-Step-1.jpg"", ""2"": ""https://www.wikihow.com/images/thumb/c/ca/Pass-Hitman-Contracts-%22Asylum-Aftermath%22-Step-2.jpg/aid915298-v4-728px-Pass-Hitman-Contracts-%22Asylum-Aftermath%22-Step-2.jpg"", ""3"": ""https://www.wikihow.com/images/thumb/6/60/Pass-Hitman-Contracts-%22Asylum-Aftermath%22-Step-3.jpg/aid915298-v4-728px-Pass-Hitman-Contracts-%22Asylum-Aftermath%22-Step-3.jpg"", ""4"": ""https://www.wikihow.com/images/thumb/8/88/Pass-Hitman-Contracts-%22Asylum-Aftermath%22-Step-4.jpg/aid915298-v4-728px-Pass-Hitman-Contracts-%22Asylum-Aftermath%22-Step-4.jpg"", ""5"": ""https://www.wikihow.com/images/thumb/b/bb/Pass-Hitman-Contracts-%22Asylum-Aftermath%22-Step-5.jpg/aid915298-v4-728px-Pass-Hitman-Contracts-%22Asylum-Aftermath%22-Step-5.jpg"", ""6"": ""https://www.wikihow.com/images/thumb/2/23/Pass-Hitman-Contracts-%22Asylum-Aftermath%22-Step-6.jpg/aid915298-v4-728px-Pass-Hitman-Contracts-%22Asylum-Aftermath%22-Step-6.jpg""}",Hitman Contracts
How to Make a Proper Jaegerbomb,www.wikihow.com/Make-a-Proper-Jaegerbomb,"So, you&#x27;ve heard about this increasingly popular beverage and you&#x27;d like to make one yourself. Maybe you ordered one at a bar and it wasn&#x27;t what you expected. This drink is ridiculously easy to make, requiring no bartending skill whatsoever, and it&#x27;s very good.",6,Food and Entertaining,"{""1"": ""Pour a shot of J\u00e4germeister into the shot glass."", ""2"": ""Red Bull into the tall glass."", ""3"": ""Hold the tall glass in your primary hand and the shot glass in your secondary hand."", ""4"": ""Take a deep breath."", ""5"": ""When ready, drop the shot glass into the tall glass, bottom first."", ""6"": ""Chug the J\u00e4gerbomb.""}","{""1"": ""https://www.wikihow.com/images/thumb/f/fa/Make-a-Proper-Jaegerbomb-Step-1.jpg/aid556265-v4-728px-Make-a-Proper-Jaegerbomb-Step-1.jpg"", ""2"": ""https://www.wikihow.com/images/thumb/b/b3/Make-a-Proper-Jaegerbomb-Step-2.jpg/aid556265-v4-728px-Make-a-Proper-Jaegerbomb-Step-2.jpg"", ""3"": ""https://www.wikihow.com/images/thumb/9/9e/Make-a-Proper-Jaegerbomb-Step-3.jpg/aid556265-v4-728px-Make-a-Proper-Jaegerbomb-Step-3.jpg"", ""4"": ""https://www.wikihow.com/images/thumb/f/f7/Make-a-Proper-Jaegerbomb-Step-4.jpg/aid556265-v4-728px-Make-a-Proper-Jaegerbomb-Step-4.jpg"", ""5"": ""https://www.wikihow.com/images/thumb/7/7d/Make-a-Proper-Jaegerbomb-Step-5.jpg/aid556265-v4-728px-Make-a-Proper-Jaegerbomb-Step-5.jpg"", ""6"": ""https://www.wikihow.com/images/thumb/3/3b/Make-a-Proper-Jaegerbomb-Step-6.jpg/aid556265-v4-728px-Make-a-Proper-Jaegerbomb-Step-6.jpg""}","1 shot glass per drink,1 tall glass per drink"
